{
  "schemaVersion": "1.0.0",
  "id": "IOS-FIGMA-ARCHITECTURE",
  "name": "InterfaceOS canonical Figma architecture",
  "figmaFile": {
    "name": "InterfaceOS — Design System",
    "url": "https://www.figma.com/design/OJqxFKoGjRh4rrSZCKdkzi/InterfaceOS-%E2%80%94-Design-System?node-id=2-11&t=ooeNCCEtH5b0vcgR-1",
    "registeredDate": "2026-08-04",
    "owner": "Jai Singh",
    "status": "IOS-003.3 color variables reconciled; ready for approval",
    "phase": "IOS-003.3 reconciliation",
    "fileKey": {
      "status": "captured",
      "value": "OJqxFKoGjRh4rrSZCKdkzi"
    },
    "libraryKey": {
      "status": "pending-human-capture",
      "value": null
    },
    "accessPolicy": {
      "status": "captured",
      "value": "Owner Jai Singh; InterfaceOS Design System project; file sharing and edit permissions recorded separately from library publication governance; publishing permission confirmed; branching enabled"
    }
  },
  "approvedDecisions": {
    "status": "accepted",
    "approvedDate": "2026-08-05",
    "owner": "Jai Singh",
    "canonicalTokenDecision": "ADR-0003",
    "figmaRepresentationDecision": "ADR-0004",
    "evidenceDecision": "ADR-0005",
    "evidenceSchemaVersion": "2.0.0",
    "collections": [
      {
        "name": "Primitive",
        "authoredModes": [],
        "implementationStatus": "reconciled-ready-for-approval",
        "collectionId": {
          "status": "captured",
          "value": "VariableCollectionId:63:14"
        },
        "storageModes": ["63:0"],
        "colorVariableCount": 100,
        "publishingState": "unpublished"
      },
      {
        "name": "Semantic",
        "authoredModes": [],
        "implementationStatus": "reconciled-ready-for-approval",
        "collectionId": {
          "status": "captured",
          "value": "VariableCollectionId:63:15"
        },
        "storageModes": ["63:1"],
        "colorVariableCount": 35,
        "publishingState": "unpublished"
      },
      {
        "name": "Theme",
        "authoredModes": ["Light", "Dark"],
        "implementationStatus": "reconciled-ready-for-approval",
        "collectionId": {
          "status": "captured",
          "value": "VariableCollectionId:63:16"
        },
        "storageModes": ["63:2", "63:5"],
        "colorVariableCount": 35,
        "publishingState": "unpublished"
      },
      {
        "name": "Responsive",
        "authoredModes": [],
        "implementationStatus": "approved-color-foundation-v1",
        "collectionId": {
          "status": "captured",
          "value": "VariableCollectionId:63:17"
        },
        "storageModes": ["63:3"],
        "colorVariableCount": 0,
        "publishingState": "unpublished"
      },
      {
        "name": "Motion",
        "authoredModes": [],
        "implementationStatus": "approved-color-foundation-v1",
        "collectionId": {
          "status": "captured",
          "value": "VariableCollectionId:63:18"
        },
        "storageModes": ["63:4"],
        "colorVariableCount": 0,
        "publishingState": "unpublished"
      }
    ],
    "representationPolicies": {
      "shadows": "effect-styles",
      "borders": "variables-with-composed-stroke-styles-only",
      "cubicBezier": "technical-metadata",
      "typography": "primary-available-font-with-code-fallback-stack",
      "zIndex": "technical-metadata",
      "breakpoints": "reference-variables",
      "grid": "layout-grid-styles-with-open-token-decision",
      "elevation": "documentation-concept-sharing-shadow-source"
    },
    "publishingPolicy": {
      "state": "unpublished-during-foundations",
      "publishAfter": [
        "variable-mapping",
        "visual-review",
        "evidence-capture",
        "approval"
      ]
    },
    "generatedDistributionPolicy": "gitignored-ci-reproducible",
    "temporaryReviewRoles": [
      "design",
      "documentation",
      "governance",
      "release"
    ],
    "pendingSpecialistReviews": ["engineering", "accessibility"],
    "specialistReviewPolicy": "accessibility-audit-non-blocking-for-foundation-v1-required-before-public-release",
    "openDecisions": [
      "canonical-grid-token-source",
      "font-delivery-and-licensing"
    ]
  },
  "pages": [
    {
      "order": 0,
      "name": "00 Cover",
      "status": "architecture-created",
      "nodeId": {
        "status": "pending-human-capture",
        "value": null
      },
      "items": []
    },
    {
      "order": 1,
      "name": "01 Getting Started",
      "status": "architecture-created",
      "nodeId": {
        "status": "pending-human-capture",
        "value": null
      },
      "items": []
    },
    {
      "order": 2,
      "name": "02 Design Principles",
      "status": "architecture-created",
      "nodeId": {
        "status": "pending-human-capture",
        "value": null
      },
      "items": []
    },
    {
      "order": 3,
      "name": "03 Foundations",
      "status": "foundation-reconciliation-ready-for-approval",
      "nodeId": {
        "status": "captured",
        "value": "2:4"
      },
      "items": [
        {
          "name": "Color",
          "kind": "foundation-section",
          "status": "reconciled-ready-for-approval",
          "nodeId": {
            "status": "captured",
            "value": "26:14"
          },
          "relatedEvidenceIds": ["IOS-FND-FIGMA-ARCHITECTURE", "IOS-FND-COLOR"],
          "plannedDocumentationPaths": [
            "docs/design-system/figma/foundation-specimens.md",
            "docs/design-system/foundations/color/color-foundation-specification.md",
            "docs/design-system/foundations/color/figma-page-blueprint.md"
          ],
          "plannedTokenSourceMappings": [
            "packages/tokens/src/primitives/color.tokens.json",
            "packages/tokens/src/primitives/color-data.tokens.json",
            "packages/tokens/src/semantic/color.tokens.json",
            "packages/tokens/src/themes/light.tokens.json",
            "packages/tokens/src/themes/dark.tokens.json"
          ]
        },
        {
          "name": "Typography",
          "kind": "foundation-section",
          "status": "placeholder-created",
          "nodeId": {
            "status": "pending-human-capture",
            "value": null
          },
          "relatedEvidenceIds": [
            "IOS-FND-FIGMA-ARCHITECTURE",
            "IOS-FND-TYPOGRAPHY"
          ],
          "plannedDocumentationPaths": [
            "docs/design-system/figma/foundation-specimens.md"
          ],
          "plannedTokenSourceMappings": [
            "packages/tokens/src/primitives/typography.tokens.json"
          ]
        },
        {
          "name": "Spacing",
          "kind": "foundation-section",
          "status": "placeholder-created",
          "nodeId": {
            "status": "pending-human-capture",
            "value": null
          },
          "relatedEvidenceIds": [
            "IOS-FND-FIGMA-ARCHITECTURE",
            "IOS-FND-SPACING"
          ],
          "plannedDocumentationPaths": [
            "docs/design-system/figma/foundation-specimens.md"
          ],
          "plannedTokenSourceMappings": [
            "packages/tokens/src/primitives/spacing.tokens.json"
          ]
        },
        {
          "name": "Sizing",
          "kind": "foundation-section",
          "status": "placeholder-created",
          "nodeId": {
            "status": "pending-human-capture",
            "value": null
          },
          "relatedEvidenceIds": [
            "IOS-FND-FIGMA-ARCHITECTURE",
            "IOS-FND-SIZING"
          ],
          "plannedDocumentationPaths": [
            "docs/design-system/figma/foundation-specimens.md"
          ],
          "plannedTokenSourceMappings": [
            "packages/tokens/src/primitives/sizing.tokens.json"
          ]
        },
        {
          "name": "Grid",
          "kind": "foundation-section",
          "status": "placeholder-created",
          "nodeId": {
            "status": "pending-human-capture",
            "value": null
          },
          "relatedEvidenceIds": [
            "IOS-FND-FIGMA-ARCHITECTURE",
            "IOS-FND-BREAKPOINT",
            "IOS-FND-SPACING",
            "IOS-FND-SIZING"
          ],
          "plannedDocumentationPaths": [
            "docs/design-system/figma/foundation-specimens.md"
          ],
          "plannedTokenSourceMappings": []
        },
        {
          "name": "Radius",
          "kind": "foundation-section",
          "status": "placeholder-created",
          "nodeId": {
            "status": "pending-human-capture",
            "value": null
          },
          "relatedEvidenceIds": [
            "IOS-FND-FIGMA-ARCHITECTURE",
            "IOS-FND-RADIUS"
          ],
          "plannedDocumentationPaths": [
            "docs/design-system/figma/foundation-specimens.md"
          ],
          "plannedTokenSourceMappings": [
            "packages/tokens/src/primitives/radius.tokens.json"
          ]
        },
        {
          "name": "Borders",
          "kind": "foundation-section",
          "status": "placeholder-created",
          "nodeId": {
            "status": "pending-human-capture",
            "value": null
          },
          "relatedEvidenceIds": [
            "IOS-FND-FIGMA-ARCHITECTURE",
            "IOS-FND-BORDER",
            "IOS-FND-COLOR"
          ],
          "plannedDocumentationPaths": [
            "docs/design-system/figma/foundation-specimens.md"
          ],
          "plannedTokenSourceMappings": [
            "packages/tokens/src/primitives/border.tokens.json",
            "packages/tokens/src/semantic/color.tokens.json"
          ]
        },
        {
          "name": "Elevation",
          "kind": "foundation-section",
          "status": "placeholder-created",
          "nodeId": {
            "status": "pending-human-capture",
            "value": null
          },
          "relatedEvidenceIds": [